{
  "$schema": "http://json-schema.org/draft-07/schema#",
  "$id": "urn:coding-cost:contribution:2.0",
  "description": "本地输入格式。贡献前须先校验原任务标识，再由 prepareContribution 替换任务、窗口和工作流标识。可选工作摘要只接受功能类别、代码量区间和与周期一致的难度枚举，不接收自由描述、源码、路径或原始行数。服务器重算后仅保存周期与额度摘要及工作摘要计数分布。",
  "type": "object", "additionalProperties": false,
  "required": ["schema_version", "dataset_kind", "currency", "quota_samples", "cost_periods"],
  "properties": {
    "schema_version": { "const": "2.0" }, "dataset_kind": { "enum": ["synthetic", "user_reported"] }, "currency": { "const": "CNY" },
    "quota_samples": { "type": "array", "maxItems": 20, "items": { "$ref": "#/definitions/quota" } },
    "cost_periods": { "type": "array", "maxItems": 12, "items": { "$ref": "#/definitions/period" } }
  },
  "definitions": {
    "id": { "type": "string", "minLength": 1, "maxLength": 48, "pattern": "^[A-Za-z0-9][A-Za-z0-9._-]{0,47}$" },
    "time": { "type": "string", "pattern": "^\\d{4}-\\d{2}-\\d{2}T\\d{2}:\\d{2}:\\d{2}Z$" },
    "money": { "type": "number", "minimum": 0, "maximum": 100000000 },
    "tokens": { "type": "integer", "minimum": 0, "maximum": 1000000000000 },
    "token_usage": {
      "type": "object", "additionalProperties": false,
      "required": ["token_semantics", "reasoning_in_output", "input_tokens", "output_tokens", "cache_read_tokens", "cache_write_tokens", "reasoning_tokens", "normalized_total_tokens"],
      "properties": {
        "token_semantics": { "enum": ["input_includes_cache", "input_excludes_cache"] }, "reasoning_in_output": { "type": "boolean" },
        "input_tokens": { "$ref": "#/definitions/tokens" }, "output_tokens": { "$ref": "#/definitions/tokens" },
        "cache_read_tokens": { "$ref": "#/definitions/tokens" }, "cache_write_tokens": { "$ref": "#/definitions/tokens" },
        "reasoning_tokens": { "$ref": "#/definitions/tokens" }, "normalized_total_tokens": { "$ref": "#/definitions/tokens" }
      }
    },
    "snapshot": {
      "type": "object", "additionalProperties": false, "required": ["observed_at", "used_percent", "token_usage", "api_equivalent_cny"],
      "properties": { "observed_at": { "$ref": "#/definitions/time" }, "used_percent": { "type": "number", "minimum": 0, "maximum": 100 }, "token_usage": { "$ref": "#/definitions/token_usage" }, "api_equivalent_cny": { "$ref": "#/definitions/money" } }
    },
    "quota": {
      "type": "object", "additionalProperties": false,
      "required": ["provider_id", "plan_id", "subject_kind", "subject_id", "quota_pool_id", "window_id", "window_start", "window_end", "price_snapshot_id", "quota_source", "window_type", "coverage", "before", "after"],
      "properties": {
        "provider_id": { "$ref": "#/definitions/id" }, "plan_id": { "$ref": "#/definitions/id" }, "subject_kind": { "enum": ["model", "workflow"] }, "subject_id": { "$ref": "#/definitions/id" },
        "quota_pool_id": { "$ref": "#/definitions/id" }, "window_id": { "$ref": "#/definitions/id" }, "price_snapshot_id": { "$ref": "#/definitions/id" },
        "quota_source": { "enum": ["official_api", "official_cli", "user_snapshot", "local_estimate"] }, "window_type": { "enum": ["fixed_reset", "rolling"] }, "coverage": { "enum": ["complete", "partial", "unknown"] },
        "window_start": { "$ref": "#/definitions/time" }, "window_end": { "$ref": "#/definitions/time" }, "before": { "$ref": "#/definitions/snapshot" }, "after": { "$ref": "#/definitions/snapshot" }
      }
    },
    "costs": {
      "type": "object", "additionalProperties": false, "required": ["subscription_cny", "overage_cny", "other_api_cny", "refund_cny"],
      "properties": { "subscription_cny": { "$ref": "#/definitions/money" }, "overage_cny": { "$ref": "#/definitions/money" }, "other_api_cny": { "$ref": "#/definitions/money" }, "refund_cny": { "$ref": "#/definitions/money" } }
    },
    "work_summary": {
      "type": "object", "additionalProperties": false,
      "description": "可选脱敏工作摘要。仅用封闭枚举描述工作类别和规模；难度须与所属周期一致。代码行数区间只描述规模，不用于产出质量或性价比排名。",
      "required": ["function_category", "code_change_band", "difficulty"],
      "properties": {
        "function_category": { "enum": ["interface", "api", "data_processing", "automation", "integration", "infrastructure", "testing", "documentation", "other"] },
        "code_change_band": { "enum": ["not_applicable", "1_50", "51_200", "201_500", "501_1000", "1000_plus"] },
        "difficulty": { "enum": ["simple", "medium", "complex"] }
      }
    },
    "task": {
      "description": "一条不同任务的统计记录。attempt_count 包括首次尝试和重试；accepted 为该任务最终是否通过本周期统一声明的验收标准。任务标识仅用于周期内去重，原值不上传。",
      "type": "object", "additionalProperties": false, "required": ["task_id", "attempt_count", "accepted", "human_minutes", "token_usage", "api_equivalent_cny"],
      "properties": {
        "task_id": { "$ref": "#/definitions/id" }, "attempt_count": { "type": "integer", "minimum": 1, "maximum": 100 }, "accepted": { "type": "boolean" },
        "human_minutes": { "type": "number", "minimum": 0, "maximum": 1000000 }, "token_usage": { "$ref": "#/definitions/token_usage" }, "api_equivalent_cny": { "$ref": "#/definitions/money" },
        "work_summary": { "$ref": "#/definitions/work_summary" }
      }
    },
    "period": {
      "type": "object", "additionalProperties": false,
      "required": ["provider_id", "plan_id", "subject_kind", "subject_id", "period_start", "period_end", "complete_period", "all_attempted_tasks_included", "task_type", "difficulty", "acceptance_standard", "payment_category", "costs", "tasks"],
      "properties": {
        "provider_id": { "$ref": "#/definitions/id" }, "plan_id": { "$ref": "#/definitions/id" }, "subject_kind": { "enum": ["model", "workflow"] }, "subject_id": { "$ref": "#/definitions/id" },
        "period_start": { "$ref": "#/definitions/time" }, "period_end": { "$ref": "#/definitions/time" }, "complete_period": { "const": true }, "all_attempted_tasks_included": { "const": true },
        "task_type": { "enum": ["bugfix", "feature", "refactor", "tests", "docs"] }, "difficulty": { "enum": ["simple", "medium", "complex"] }, "acceptance_standard": { "enum": ["test_suite_passed", "review_approved", "spec_checklist_passed"] },
        "payment_category": { "enum": ["standard", "promotional", "credit", "trial", "unknown"] },
        "costs": { "$ref": "#/definitions/costs" }, "tasks": { "type": "array", "minItems": 1, "maxItems": 1000, "items": { "$ref": "#/definitions/task" } }
      }
    }
  }
}
